{
  "specversion": "1.0",
  "id": "3f1a2c3d-4e5f-4a1b-9c2d-3e4f5a6b7c82",
  "type": "com.nabhold.identity.disabled.v1",
  "source": "urn:nabhold:service:baobab-iam",
  "subject": "principal:8f14e45f-ceea-467e-bd42-7f8f8f8f8f8f",
  "time": "2026-09-10T10:05:00Z",
  "datacontenttype": "application/json",
  "dataschema": "https://schemas.nabhold.com/contracts/identity-events/v1/identity-disabled.schema.json",
  "baobabscope": "platform",
  "correlationid": "9b2c3d4e-5f6a-4b1c-8d2e-3f4a5b6c7d82",
  "data": {
    "principal_id": "8f14e45f-ceea-467e-bd42-7f8f8f8f8f8f",
    "previous_status": "ACTIVE",
    "new_status": "DISABLED",
    "reason": "OFFBOARDING_WORKFLOW_COMPLETED",
    "actor": "system:baobab-iam-lifecycle-service"
  }
}
