{
  "specversion": "1.0",
  "id": "3c4d5e6f-7a8b-4c1d-9e2f-4a5b6c7d8e1b",
  "type": "com.nabhold.supplier-onboarding.capability.verified.v1",
  "source": "urn:nabhold:service:thamani",
  "subject": "supplier-application:sup_01k4p8q2r3s4",
  "time": "2026-09-09T11:15:00Z",
  "datacontenttype": "application/json",
  "dataschema": "https://contracts.nabhold.com/supplier-onboarding/v1/supplier-capability-verified.schema.json",
  "baobabscope": "tenant",
  "correlationid": "9b2c3d4e-5f6a-4b1c-8d2e-3f4a5b6c7d8e",
  "tenantid": "tn_01k4m7x9q2v6c8r3d5f1h0j4",
  "data": {
    "estate_id": "thamani_global",
    "legal_entity_id": "THAMANI-GLOBAL",
    "application_id": "sup_01k4p8q2r3s4",
    "canonical_organisation_id": null,
    "capability_id": "cap_01k4p9r2",
    "product_category": "fresh-produce",
    "verification_status": "verified",
    "verified_by": "user:usr_review_bot",
    "verified_at": "2026-09-09T11:15:00Z",
    "revision": 1
  }
}
