{
  "specversion": "1.0",
  "id": "3f1a2c3d-4e5f-4a1b-9c2d-3e4f5a6b7c85",
  "type": "com.nabhold.entitlement.revoked.v1",
  "source": "urn:nabhold:service:baobab-cp",
  "subject": "principal:8f14e45f-ceea-467e-bd42-7f8f8f8f8f8f",
  "time": "2026-09-10T10:30:00Z",
  "datacontenttype": "application/json",
  "dataschema": "https://schemas.nabhold.com/contracts/identity-events/v1/entitlement-revoked.schema.json",
  "baobabscope": "tenant",
  "tenantid": "tn_gate1test",
  "correlationid": "9b2c3d4e-5f6a-4b1c-8d2e-3f4a5b6c7d85",
  "data": {
    "entitlement_id": "4a2b3c4d-5e6f-4a1b-9c2d-3e4f5a6b7c85",
    "principal_id": "8f14e45f-ceea-467e-bd42-7f8f8f8f8f8f",
    "capability_key": "baobab_erp",
    "previous_status": "ACTIVE",
    "new_status": "REVOKED",
    "reason": "ROLE_CHANGE",
    "actor": "human:cp-admin-7"
  }
}
