{
  "specversion": "1.0",
  "id": "1d032305-669c-45df-b988-01166de4c14c",
  "type": "com.nabhold.erp.order.consequence-changed.v1",
  "source": "urn:nabhold:service:baobab-erp",
  "subject": "order:order_01k4n6w5",
  "time": "2026-09-01T10:00:03Z",
  "datacontenttype": "application/json",
  "dataschema": "https://contracts.nabhold.com/erp/v1/order-consequence-status.schema.json",
  "baobabscope": "tenant",
  "correlationid": "ea733cd4-0daa-4c52-89f8-a940cfa8a1ac",
  "causationid": "04ac0f78-b5f5-4a50-9296-39264d533433",
  "tenantid": "tn_01k4m7x9q2v6c8r3d5f1h0j4",
  "idempotencykey": "trade-order-order_01k4n6w5-v1",
  "data": {
    "legal_entity_id": "ZURIBEANS",
    "commerce_order_id": "order_01k4n6w5",
    "order_version": 1,
    "erp_order_id": "erp_01k4n7a9",
    "status": "posted",
    "accounting_status": "posted",
    "inventory_status": "allocated",
    "invoice_id": "erp_01k4n7bq",
    "revision": 2,
    "updated_at": "2026-09-01T10:00:03Z"
  }
}
