{
  "specversion": "1.0",
  "id": "3f1a2c3d-4e5f-4a1b-9c2d-3e4f5a6b7c88",
  "type": "com.nabhold.workload.revoked.v1",
  "source": "urn:nabhold:service:baobab-iam",
  "subject": "principal:6c5d4e3f-2a1b-4c9d-8e7f-6a5b4c3d2e1f",
  "time": "2026-09-10T11:00:00Z",
  "datacontenttype": "application/json",
  "dataschema": "https://schemas.nabhold.com/contracts/identity-events/v1/workload-revoked.schema.json",
  "baobabscope": "platform",
  "correlationid": "9b2c3d4e-5f6a-4b1c-8d2e-3f4a5b6c7d89",
  "data": {
    "principal_id": "6c5d4e3f-2a1b-4c9d-8e7f-6a5b4c3d2e1f",
    "client_id": "baobab-trade-workload",
    "previous_status": "ACTIVE",
    "new_status": "REVOKED",
    "reason": "SECURITY_COMPROMISE",
    "actor": "system:baobab-iam-security-automation"
  }
}
