{
  "specversion": "1.0",
  "id": "3f1a2c3d-4e5f-4a1b-9c2d-3e4f5a6b7c87",
  "type": "com.nabhold.session.revoked.v1",
  "source": "urn:nabhold:service:baobab-iam",
  "subject": "principal:8f14e45f-ceea-467e-bd42-7f8f8f8f8f8f",
  "time": "2026-09-10T10:50:00Z",
  "datacontenttype": "application/json",
  "dataschema": "https://schemas.nabhold.com/contracts/identity-events/v1/session-revoked.schema.json",
  "baobabscope": "platform",
  "correlationid": "9b2c3d4e-5f6a-4b1c-8d2e-3f4a5b6c7d87",
  "data": {
    "session_id": "5b3c4d5e-6f7a-4b1c-8d2e-3f4a5b6c7d88",
    "principal_id": "8f14e45f-ceea-467e-bd42-7f8f8f8f8f8f",
    "previous_status": "ACTIVE",
    "new_status": "REVOKED",
    "reason": "SECURITY_COMPROMISE",
    "actor": "system:baobab-iam-security-automation"
  }
}
