{
  "specversion": "1.0",
  "id": "3f1a2c3d-4e5f-4a1b-9c2d-3e4f5a6b7c81",
  "type": "com.nabhold.identity.created.v1",
  "source": "urn:nabhold:service:baobab-iam",
  "subject": "principal:8f14e45f-ceea-467e-bd42-7f8f8f8f8f8f",
  "time": "2026-09-10T10:00:00Z",
  "datacontenttype": "application/json",
  "dataschema": "https://schemas.nabhold.com/contracts/identity-events/v1/identity-created.schema.json",
  "baobabscope": "platform",
  "correlationid": "9b2c3d4e-5f6a-4b1c-8d2e-3f4a5b6c7d81",
  "data": {
    "principal_id": "8f14e45f-ceea-467e-bd42-7f8f8f8f8f8f",
    "actor_type": "human",
    "external_issuer": "https://iam.nabhold.com/realms/baobab",
    "external_subject": "f47ac10b-58cc-4372-a567-0e02b2c3d479"
  }
}
