{
  "specversion": "1.0",
  "id": "3f376bc2-16a3-4779-99a2-ce2c2a299051",
  "type": "com.nabhold.erp.warehouse.changed.v1",
  "source": "urn:nabhold:service:baobab-erp",
  "subject": "warehouse:erp_01k4n7dg",
  "time": "2026-09-01T08:00:00Z",
  "datacontenttype": "application/json",
  "dataschema": "https://contracts.nabhold.com/erp/v1/warehouse-projection.schema.json",
  "baobabscope": "tenant",
  "correlationid": "4db5655f-fb7b-4e25-bc3c-52325efaa48d",
  "tenantid": "tn_01k4m7x9q2v6c8r3d5f1h0j4",
  "data": {
    "legal_entity_id": "ZURIBEANS",
    "warehouse_id": "erp_01k4n7dg",
    "code": "NBO-01",
    "name": "Nairobi Distribution Centre",
    "country": "KE",
    "timezone": "Africa/Nairobi",
    "status": "active",
    "revision": 3
  }
}
