{
  "specversion": "1.0",
  "id": "3f1a2c3d-4e5f-4a1b-9c2d-3e4f5a6b7c83",
  "type": "com.nabhold.membership.revoked.v1",
  "source": "urn:nabhold:service:baobab-cp",
  "subject": "membership:2c9a1e3d-6b4f-4c8a-9d2e-1a3b5c7d9e0f",
  "time": "2026-09-10T10:10:00Z",
  "datacontenttype": "application/json",
  "dataschema": "https://schemas.nabhold.com/contracts/identity-events/v1/membership-revoked.schema.json",
  "baobabscope": "tenant",
  "correlationid": "9b2c3d4e-5f6a-4b1c-8d2e-3f4a5b6c7d83",
  "tenantid": "tn_01k4m7x9q2v6c8r3d5f1h0j5",
  "data": {
    "membership_id": "2c9a1e3d-6b4f-4c8a-9d2e-1a3b5c7d9e0f",
    "principal_id": "8f14e45f-ceea-467e-bd42-7f8f8f8f8f8f",
    "resource_type": "tenant",
    "resource_id": "tn_01k4m7x9q2v6c8r3d5f1h0j5",
    "previous_status": "ACTIVE",
    "new_status": "REVOKED",
    "reason": "OFFBOARDING_WORKFLOW_COMPLETED",
    "actor": "system:baobab-cp-lifecycle-service"
  }
}
