{
  "specversion": "1.0",
  "id": "78844bfb-4ad7-446a-b8bf-4dad336e6beb",
  "type": "com.nabhold.erp.provisioning.changed.v1",
  "source": "urn:nabhold:service:baobab-erp",
  "subject": "provisioning:1d5a1ea4-6355-4ca2-b851-4ebde6847035",
  "time": "2026-09-01T08:05:00Z",
  "datacontenttype": "application/json",
  "dataschema": "https://contracts.nabhold.com/erp/v1/provisioning-state.schema.json",
  "baobabscope": "tenant",
  "correlationid": "e7a5b216-c90d-4a36-99f3-e1d81276638f",
  "tenantid": "tn_01k4m7x9q2v6c8r3d5f1h0j4",
  "idempotencykey": "erp-provisioning-1d5a1ea4-6355-4ca2-b851-4ebde6847035",
  "data": {
    "operation_id": "1d5a1ea4-6355-4ca2-b851-4ebde6847035",
    "tenant_id": "tn_01k4m7x9q2v6c8r3d5f1h0j4",
    "legal_entity_ids": ["ZURIBEANS"],
    "state": "active",
    "revision": 5,
    "updated_at": "2026-09-01T08:05:00Z"
  }
}
