{
  "specversion": "1.0",
  "id": "1a2b3c4d-5e6f-4a1b-9c2d-3e4f5a6b7c9f",
  "type": "com.nabhold.supplier-onboarding.application.decided.v1",
  "source": "urn:nabhold:service:thamani",
  "subject": "supplier-application:sup_01k4p8q2r3s4",
  "time": "2026-09-10T09:30:00Z",
  "datacontenttype": "application/json",
  "dataschema": "https://contracts.nabhold.com/supplier-onboarding/v1/supplier-application-decided.schema.json",
  "baobabscope": "tenant",
  "correlationid": "9b2c3d4e-5f6a-4b1c-8d2e-3f4a5b6c7d8e",
  "causationid": "6f1a2c3d-4e5f-4a1b-9c2d-3e4f5a6b7c8d",
  "tenantid": "tn_01k4m7x9q2v6c8r3d5f1h0j4",
  "data": {
    "estate_id": "thamani_global",
    "legal_entity_id": "THAMANI-GLOBAL",
    "application_id": "sup_01k4p8q2r3s4",
    "canonical_organisation_id": null,
    "decision": "approved",
    "applicant_visible_explanation": null,
    "decided_at": "2026-09-10T09:30:00Z",
    "revision": 2
  }
}
