{
  "specversion": "1.0",
  "id": "1d503979-d232-43c8-8d7c-5bd4f986e878",
  "type": "com.nabhold.erp.payment.accounting-changed.v1",
  "source": "urn:nabhold:service:baobab-erp",
  "subject": "payment:capture_01k4n73j",
  "time": "2026-09-01T10:01:00Z",
  "datacontenttype": "application/json",
  "dataschema": "https://contracts.nabhold.com/erp/v1/payment-outcome.schema.json",
  "baobabscope": "tenant",
  "correlationid": "ea733cd4-0daa-4c52-89f8-a940cfa8a1ac",
  "tenantid": "tn_01k4m7x9q2v6c8r3d5f1h0j4",
  "data": {
    "legal_entity_id": "ZURIBEANS",
    "payment_capture_id": "capture_01k4n73j",
    "erp_payment_id": "erp_01k4n7g4",
    "invoice_id": "erp_01k4n7bq",
    "status": "allocated",
    "amount": { "amount": "324.00", "currency": "USD" },
    "accounted_at": "2026-09-01T10:01:00Z",
    "revision": 2
  }
}
